{
  "input_inventory": {
    "label_map_path": "<repo>/runs/totalsegmentator_skeleton_topology_source_pass/predicted_seg.nii.gz",
    "label_map_readable": true,
    "label_map_shape": [
      200,
      200,
      200
    ]
  },
  "overall": "pass",
  "rib_pair_symmetry": {
    "asymmetric_pairs": [],
    "checks": [
      {
        "missing": [],
        "name": "rib_pair_bilateral_present",
        "reason": "all rib indices have both left+right",
        "status": "pass"
      },
      {
        "asymmetric": [],
        "name": "rib_pair_volume_symmetric",
        "reason": "all pairs within 40%",
        "status": "pass"
      }
    ],
    "missing_partners": [],
    "pairs": [
      {
        "left_present": true,
        "left_voxel_count": 2250,
        "ok": true,
        "relative_diff": 0.0,
        "rib_index": 1,
        "right_present": true,
        "right_voxel_count": 2250
      },
      {
        "left_present": true,
        "left_voxel_count": 2250,
        "ok": true,
        "relative_diff": 0.0,
        "rib_index": 2,
        "right_present": true,
        "right_voxel_count": 2250
      },
      {
        "left_present": true,
        "left_voxel_count": 2250,
        "ok": true,
        "relative_diff": 0.0,
        "rib_index": 3,
        "right_present": true,
        "right_voxel_count": 2250
      },
      {
        "left_present": true,
        "left_voxel_count": 2250,
        "ok": true,
        "relative_diff": 0.0,
        "rib_index": 4,
        "right_present": true,
        "right_voxel_count": 2250
      },
      {
        "left_present": true,
        "left_voxel_count": 2250,
        "ok": true,
        "relative_diff": 0.0,
        "rib_index": 5,
        "right_present": true,
        "right_voxel_count": 2250
      },
      {
        "left_present": true,
        "left_voxel_count": 3375,
        "ok": true,
        "relative_diff": 0.0,
        "rib_index": 6,
        "right_present": true,
        "right_voxel_count": 3375
      }
    ],
    "reason": "6 rib pair(s) checked, all symmetric within 40%",
    "verdict": "pass"
  },
  "target": {
    "evidence_pack": "<repo>/runs/totalsegmentator_skeleton_topology_source_pass",
    "label_map_path": "<repo>/runs/totalsegmentator_skeleton_topology_source_pass/predicted_seg.nii.gz",
    "skill_id": "totalsegmentator",
    "source_overall_status": "passed"
  },
  "verifier": {
    "id": "medagent.verifiers.totalsegmentator_skeleton_topology_v1",
    "version": "0.1.0"
  },
  "vertebra_body_size_monotonic": {
    "cervical_count": 3,
    "cervical_median_voxels": 1440.0,
    "checks": [
      {
        "name": "vertebra_size_monotonic",
        "reason": "lumbar >= thoracic >= cervical (within tolerance)",
        "status": "pass",
        "violations": []
      }
    ],
    "lumbar_count": 4,
    "lumbar_median_voxels": 9000.0,
    "reason": "vertebral body size monotonic: C=1440.0 T=4000.0 L=9000.0",
    "thoracic_count": 4,
    "thoracic_median_voxels": 4000.0,
    "verdict": "pass",
    "violations": []
  },
  "vertebra_chain": {
    "checks": [
      {
        "name": "vertebra_chain_monotonic",
        "reason": "ordered",
        "status": "pass",
        "violations": []
      }
    ],
    "direction": "descending",
    "present_in_order": [
      {
        "label_id": 46,
        "name": "C5",
        "voxel_count": 1728,
        "z_centroid": 119.5
      },
      {
        "label_id": 45,
        "name": "C6",
        "voxel_count": 1440,
        "z_centroid": 108.5
      },
      {
        "label_id": 44,
        "name": "C7",
        "voxel_count": 1440,
        "z_centroid": 98.5
      },
      {
        "label_id": 35,
        "name": "T9",
        "voxel_count": 7136,
        "z_centroid": 88.652
      },
      {
        "label_id": 34,
        "name": "T10",
        "voxel_count": 4000,
        "z_centroid": 74.5
      },
      {
        "label_id": 33,
        "name": "T11",
        "voxel_count": 4000,
        "z_centroid": 64.5
      },
      {
        "label_id": 32,
        "name": "T12",
        "voxel_count": 4000,
        "z_centroid": 54.5
      },
      {
        "label_id": 31,
        "name": "L1",
        "voxel_count": 21000,
        "z_centroid": 47.357
      },
      {
        "label_id": 30,
        "name": "L2",
        "voxel_count": 9000,
        "z_centroid": 29.5
      },
      {
        "label_id": 29,
        "name": "L3",
        "voxel_count": 9000,
        "z_centroid": 19.5
      },
      {
        "label_id": 28,
        "name": "L4",
        "voxel_count": 9000,
        "z_centroid": 9.5
      }
    ],
    "reason": "11 vertebrae, z-centroids monotonically descending",
    "verdict": "pass",
    "violations": []
  }
}